Sheet: Sheet2
A1: 1 | B1: =RC[-1] -> 1 | C1: foo | D1: x
A2: 2 | B2: =RC[-1]+R[-1]C -> 3 | C2: bar | D2: y
A3: 3 | B3: =RC[-1]+R[-1]C -> 6 | C3: baz | D3: z
A4: 4 | B4: =RC[-1]+R[-1]C -> 10 | C4: qux | D4: w

Sheet: Sheet1
A1: foo | B1: bar | C1: baz | D1: qux
A2: =R[-1]C[1] -> bar | B2: =R[-1]C[1] -> baz | C2: =R[-1]C[1] -> qux | D2: =R[-1]C[-3] -> foo
A3: =R[-1]C[1] -> baz | B3: =R[-1]C[1] -> qux | C3: =R[-1]C[1] -> foo | D3: =R[-1]C[-3] -> bar
A4: =R[-1]C[1] -> qux | B4: =R[-1]C[1] -> foo | C4: =R[-1]C[1] -> bar | D4: =R[-1]C[-3] -> baz
A5: =R[-1]C[1] -> foo | B5: =R[-1]C[1] -> bar | C5: =R[-1]C[1] -> baz | D5: =R[-1]C[-3] -> qux
A6: =R[-1]C[1] -> bar | B6: =R[-1]C[1] -> baz | C6: =R[-1]C[1] -> qux | D6: =R[-1]C[-3] -> foo
A7: =R[-1]C[1] -> baz | B7: =R[-1]C[1] -> qux | C7: =R[-1]C[1] -> foo | D7: =R[-1]C[-3] -> bar
A8: =R[-1]C[1] -> qux | B8: =R[-1]C[1] -> foo | C8: =R[-1]C[1] -> bar | D8: =R[-1]C[-3] -> baz
A9: =R[-1]C[1] -> foo | B9: =R[-1]C[1] -> bar | C9: =R[-1]C[1] -> baz | D9: =R[-1]C[-3] -> qux
A10: =R[-1]C[1] -> bar | B10: =R[-1]C[1] -> baz | C10: =R[-1]C[1] -> qux | D10: =R[-1]C[-3] -> foo
A11: =R[-1]C[1] -> baz | B11: =R[-1]C[1] -> qux | C11: =R[-1]C[1] -> foo | D11: =R[-1]C[-3] -> bar
A12: =R[-1]C[1] -> qux | B12: =R[-1]C[1] -> foo | C12: =R[-1]C[1] -> bar | D12: =R[-1]C[-3] -> baz
A13: =R[-1]C[1] -> foo | B13: =R[-1]C[1] -> bar | C13: =R[-1]C[1] -> baz | D13: =R[-1]C[-3] -> qux
A14: =R[-1]C[1] -> bar | B14: =R[-1]C[1] -> baz | C14: =R[-1]C[1] -> qux | D14: =R[-1]C[-3] -> foo
A15: =R[-1]C[1] -> baz | B15: =R[-1]C[1] -> qux | C15: =R[-1]C[1] -> foo | D15: =R[-1]C[-3] -> bar
A16: =R[-1]C[1] -> qux | B16: =R[-1]C[1] -> foo | C16: bar | D16: =R[-1]C[-3] -> baz
A17: =R[-1]C[1] -> foo | B17: =R[-1]C[1] -> bar | C17: =R[-1]C[1] -> baz | D17: =R[-1]C[-3] -> qux
A18: =R[-1]C[1] -> bar | B18: =R[-1]C[1] -> baz | C18: =R[-1]C[1] -> qux | D18: =R[-1]C[-3] -> foo
A19: =R[-1]C[1] -> baz | B19: =R[-1]C[1] -> qux | C19: =R[-1]C[1] -> foo | D19: =R[-1]C[-3] -> bar
A20: =R[-1]C[1] -> qux | B20: =R[-1]C[1] -> foo | C20: bar | D20: =R[-1]C[-3] -> baz
A21: =R[-1]C[1] -> foo | B21: =R[-1]C[1] -> bar | C21: =R[-1]C[1] -> baz | D21: =R[-1]C[-3] -> qux
A22: =R[-1]C[1] -> bar | B22: =R[-1]C[1] -> baz | C22: =R[-1]C[1] -> qux | D22: =R[-1]C[-3] -> foo
A23: =R[-1]C[1] -> baz | B23: =R[-1]C[1] -> qux | C23: =R[-1]C[1] -> foo | D23: =R[-1]C[-3] -> bar
A24: =R[-1]C[1] -> qux | B24: =R[-1]C[1] -> foo | C24: bar | D24: =R[-1]C[-3] -> baz
A25: =R[-1]C[1] -> foo | B25: =R[-1]C[1] -> bar | C25: =R[-1]C[1] -> baz | D25: =R[-1]C[-3] -> qux
A26: =R[-1]C[1] -> bar | B26: =R[-1]C[1] -> baz | C26: =R[-1]C[1] -> qux | D26: =R[-1]C[-3] -> foo
A27: =R[-1]C[1] -> baz | B27: =R[-1]C[1] -> qux | C27: =R[-1]C[1] -> foo | D27: =R[-1]C[-3] -> bar
A28: =R[-1]C[1] -> qux | B28: =R[-1]C[1] -> foo | C28: bar | D28: =R[-1]C[-3] -> baz
A29: =R[-1]C[1] -> foo | B29: =R[-1]C[1] -> bar | C29: =R[-1]C[1] -> baz | D29: =R[-1]C[-3] -> qux
A30: =R[-1]C[1] -> bar | B30: =R[-1]C[1] -> baz | C30: =R[-1]C[1] -> qux | D30: =R[-1]C[-3] -> foo
A31: =R[-1]C[1] -> baz | B31: =R[-1]C[1] -> qux | C31: =R[-1]C[1] -> foo | D31: =R[-1]C[-3] -> bar
A32: =R[-1]C[1] -> qux | B32: =R[-1]C[1] -> foo | C32: =R[-1]C[1] -> bar | D32: =R[-1]C[-3] -> baz
A33: =R[-1]C[1] -> foo | B33: =R[-1]C[1] -> bar | C33: =R[-1]C[1] -> baz | D33: =R[-1]C[-3] -> qux

Sheet: Sheet3
A1: parsing excel files | B1: =Comment(RC[-1]) -> #NAME?
A2: requires lots of patience; | B2: =Comment(RC[-1]) -> #NAME?
A3: details for the win | B3: =Comment(R[-2]C[-1]) -> #NAME?

Sheet: Sheet4
A1: 1 | B1: 2
A2: 1 | B2: 1
A3: =R[-1]C+R[-2]C -> 2 | B3: =R[-1]C+R[-2]C -> 3
A4: =R[-1]C+R[-2]C -> 3 | B4: =R[-1]C+R[-2]C -> 4
A5: =R[-1]C+R[-2]C -> 5 | B5: =R[-1]C+R[-2]C -> 7
A6: =R[-1]C+R[-2]C -> 8 | B6: =R[-1]C+R[-2]C -> 11
A7: =R[-1]C+R[-2]C -> 13 | B7: =R[-1]C+R[-2]C -> 18
A8: =R[-1]C+R[-2]C -> 21 | B8: =R[-1]C+R[-2]C -> 29
A9: =R[-1]C+R[-2]C -> 34 | B9: =R[-1]C+R[-2]C -> 47
A10: =R[-1]C+R[-2]C -> 55 | B10: =R[-1]C+R[-2]C -> 76
A11: =R[-1]C+R[-2]C -> 89 | B11: =R[-1]C+R[-2]C -> 123
A12: =R[-1]C+R[-2]C -> 144 | B12: =R[-1]C+R[-2]C -> 199
A13: =R[-1]C+R[-2]C -> 233 | B13: =R[-1]C+R[-2]C -> 322
A14: =R[-1]C+R[-2]C -> 377 | B14: =R[-1]C+R[-2]C -> 521
A15: =R[-1]C+R[-2]C -> 610 | B15: =R[-1]C+R[-2]C -> 843
A16: =R[-1]C+R[-2]C -> 987 | B16: =R[-1]C+R[-2]C -> 1364
A17: =R[-1]C+R[-2]C -> 1597 | B17: =R[-1]C+R[-2]C -> 2207
A18: =R[-1]C+R[-2]C -> 2584 | B18: =R[-1]C+R[-2]C -> 3571
A19: =R[-1]C+R[-2]C -> 4181 | B19: =R[-1]C+R[-2]C -> 5778
A20: =R[-1]C+R[-2]C -> 6765 | B20: =R[-1]C+R[-2]C -> 9349
A21: =R[-1]C+R[-2]C -> 10946 | B21: =R[-1]C+R[-2]C -> 15127
A22: =R[-1]C+R[-2]C -> 17711 | B22: =R[-1]C+R[-2]C -> 24476
A23: =R[-1]C+R[-2]C -> 28657 | B23: =R[-1]C+R[-2]C -> 39603
A24: =R[-1]C+R[-2]C -> 46368 | B24: =R[-1]C+R[-2]C -> 64079
A25: =R[-1]C+R[-2]C -> 75025 | B25: =R[-1]C+R[-2]C -> 103682
A26: =R[-1]C+R[-2]C -> 121393 | B26: =R[-1]C+R[-2]C -> 167761
A27: =R[-1]C+R[-2]C -> 196418 | B27: =R[-1]C+R[-2]C -> 271443
A28: =R[-1]C+R[-2]C -> 317811 | B28: =R[-1]C+R[-2]C -> 439204
A29: =R[-1]C+R[-2]C -> 514229 | B29: =R[-1]C+R[-2]C -> 710647
A30: =R[-1]C+R[-2]C -> 832040 | B30: =R[-1]C+R[-2]C -> 1149851
A31: =R[-1]C+R[-2]C -> 1346269 | B31: =R[-1]C+R[-2]C -> 1860498
A32: =R[-1]C+R[-2]C -> 2178309 | B32: =R[-1]C+R[-2]C -> 3010349
A33: =R[-1]C+R[-2]C -> 3524578 | B33: =R[-1]C+R[-2]C -> 4870847
A34: =R[-1]C+R[-2]C -> 5702887 | B34: =R[-1]C+R[-2]C -> 7881196
A35: =R[-1]C+R[-2]C -> 9227465 | B35: =R[-1]C+R[-2]C -> 12752043
A36: =R[-1]C+R[-2]C -> 14930352 | B36: =R[-1]C+R[-2]C -> 20633239
A37: =R[-1]C+R[-2]C -> 24157817 | B37: =R[-1]C+R[-2]C -> 33385282