Sheet: Implied
A1: Format | B1: Value | C1: B Fmt | D1: VBA Fmt | E1: Fmt | F1: Macro
A2: 0 | B2: 12345.678900000001 | C2: =NumFmt(RC[-1]) -> General
A3: 1 | B3: 12345.678900000001 | C3: =NumFmt(RC[-1]) -> 0 | D3: =Dofmt(RC[-2],RC[1]) -> 12346 | E3: 0 | F3: =RC[-4] -> 12345.678900000001
A4: 2 | B4: 12345.678900000001 | C4: =NumFmt(RC[-1]) -> 0.00 | D4: =Dofmt(RC[-2],RC[1]) -> 12345.68 | E4: 0.00 | F4: =RC[-4] -> 12345.678900000001
A5: 3 | B5: 12345.678900000001 | C5: =NumFmt(RC[-1]) -> #,##0 | D5: =Dofmt(RC[-2],RC[1]) -> 12,346 | E5: #,##0 | F5: =RC[-4] -> 12345.678900000001
A6: 4 | B6: 12345.678900000001 | C6: =NumFmt(RC[-1]) -> #,##0.00 | D6: =Dofmt(RC[-2],RC[1]) -> 12,345.68 | E6: #,##0.00 | F6: =RC[-4] -> 12345.678900000001
A7: 9 | B7: 12345.678900000001 | C7: =NumFmt(RC[-1]) -> 0% | D7: =Dofmt(RC[-2],RC[1]) -> 1234568% | E7: 0% | F7: =RC[-4] -> 12345.678900000001
A8: 10 | B8: 12345.678900000001 | C8: =NumFmt(RC[-1]) -> 0.00% | D8: =Dofmt(RC[-2],RC[1]) -> 1234567.89% | E8: 0.00% | F8: =RC[-4] -> 12345.678900000001
A9: 11 | B9: 12345.678900000001 | C9: =NumFmt(RC[-1]) -> 0.00E+00 | D9: =Dofmt(RC[-2],RC[1]) -> 1.23E+04 | E9: 0.00E+00 | F9: =RC[-4] -> 12345.678900000001
A10: 12 | B10: 12345.678900000001 | C10: =NumFmt(RC[-1]) -> # ?/? | D10: =Dofmt(RC[-2],RC[1]) -> 12346 ?/? | E10: # ?/? | F10: =RC[-4] -> 12345.678900000001
A11: 13 | B11: 12345.678900000001 | C11: =NumFmt(RC[-1]) -> # ??/?? | D11: =Dofmt(RC[-2],RC[1]) -> 12346 ??/?? | E11: # ??/?? | F11: =RC[-4] -> 12345.678900000001
A12: 14 | B12: 1933-10-18T16:17:36.960 | C12: =NumFmt(RC[-1]) -> m/d/yyyy | D12: =Dofmt(RC[-2],RC[1]) -> 10/18/33 | E12: m/d/yy | F12: =RC[-4] -> 1933-10-18T16:17:36.960 | G12: * What is this supposed to be?
A13: 15 | B13: 1933-10-18T16:17:36.960 | C13: =NumFmt(RC[-1]) -> d-mmm-yy | D13: =Dofmt(RC[-2],RC[1]) -> 18-Oct-33 | E13: d-mmm-yy | F13: =RC[-4] -> 1933-10-18T16:17:36.960
A14: 16 | B14: 1933-10-18T16:17:36.960 | C14: =NumFmt(RC[-1]) -> d-mmm | D14: =Dofmt(RC[-2],RC[1]) -> 18-Oct | E14: d-mmm | F14: =RC[-4] -> 1933-10-18T16:17:36.960
A15: 17 | B15: 1933-10-18T16:17:36.960 | C15: =NumFmt(RC[-1]) -> mmm-yy | D15: =Dofmt(RC[-2],RC[1]) -> Oct-33 | E15: mmm-yy | F15: =RC[-4] -> 1933-10-18T16:17:36.960
A16: 18 | B16: 1933-10-18T16:17:36.960 | C16: =NumFmt(RC[-1]) -> h:mm AM/PM | D16: =Dofmt(RC[-2],RC[1]) -> 4:17 PM | E16: h:mm AM/PM | F16: =RC[-4] -> 1933-10-18T16:17:36.960
A17: 19 | B17: 1933-10-18T16:17:36.960 | C17: =NumFmt(RC[-1]) -> h:mm:ss AM/PM | D17: =Dofmt(RC[-2],RC[1]) -> 4:17:37 PM | E17: h:mm:ss AM/PM | F17: =RC[-4] -> 1933-10-18T16:17:36.960
A18: 20 | B18: 1933-10-18T16:17:36.960 | C18: =NumFmt(RC[-1]) -> h:mm | D18: =Dofmt(RC[-2],RC[1]) -> 16:17 | E18: h:mm | F18: =RC[-4] -> 1933-10-18T16:17:36.960
A19: 21 | B19: 1933-10-18T16:17:36.960 | C19: =NumFmt(RC[-1]) -> h:mm:ss | D19: =Dofmt(RC[-2],RC[1]) -> 16:17:37 | E19: h:mm:ss | F19: =RC[-4] -> 1933-10-18T16:17:36.960
A20: 22 | B20: 1933-10-18T16:17:36.960 | C20: =NumFmt(RC[-1]) -> m/d/yy h:mm | D20: =Dofmt(RC[-2],RC[1]) -> 10/18/33 16:17 | E20: m/d/yy h:mm | F20: =RC[-4] -> 1933-10-18T16:17:36.960
A21: 37 | B21: 12345.678900000001 | C21: =NumFmt(RC[-1]) -> #,##0 ;(#,##0) | D21: =Dofmt(RC[-2],RC[1]) -> 12,346 | E21: #,##0 ;(#,##0) | F21: =RC[-4] -> 12345.678900000001
A22: 38 | B22: 12345.678900000001 | C22: =NumFmt(RC[-1]) -> #,##0 ;[Red](#,##0) | D22: =Dofmt(RC[-2],RC[1]) -> 12,346 | E22: #,##0 ;[Red](#,##0) | F22: =RC[-4] -> 12345.678900000001
A23: 39 | B23: 12345.678900000001 | C23: =NumFmt(RC[-1]) -> #,##0.00;(#,##0.00) | D23: =Dofmt(RC[-2],RC[1]) -> 12,345.68 | E23: #,##0.00;(#,##0.00) | F23: =RC[-4] -> 12345.678900000001
A24: 40 | B24: 12345.678900000001 | C24: =NumFmt(RC[-1]) -> #,##0.00;[Red](#,##0.00) | D24: =Dofmt(RC[-2],RC[1]) -> 12,345.68 | E24: #,##0.00;[Red](#,##0.00) | F24: =RC[-4] -> 12345.678900000001
A25: 45 | B25: 1933-10-18T16:17:36.960 | C25: =NumFmt(RC[-1]) -> mm:ss | D25: =Dofmt(RC[-2],RC[1]) -> 10:37 | E25: mm:ss | F25: =RC[-4] -> 1933-10-18T16:17:36.960
A26: 46 | B26: 1933-10-18T16:17:36.960 | C26: =NumFmt(RC[-1]) -> [h]:mm:ss | D26: =Dofmt(RC[-2],RC[1]) -> :10:37 | E26: [h]:mm:ss | F26: =RC[-4] -> 1933-10-18T16:17:36.960
A27: 47 | B27: 1933-10-18T16:17:36.960 | C27: =NumFmt(RC[-1]) -> mmss.0 | D27: =Dofmt(RC[-2],RC[1]) -> 1037.0 | E27: mmss.0 | F27: =RC[-4] -> 1933-10-18T16:17:36.960
A28: 48 | B28: 12345.678900000001 | C28: =NumFmt(RC[-1]) -> ##0.0E+0 | D28: =Dofmt(RC[-2],RC[1]) -> 123.5E+2 | E28: ##0.0E+0 | F28: =RC[-4] -> 12345.678900000001
A29: 49 | B29: 12345.678900000001 | C29: =NumFmt(RC[-1]) -> @ | D29: =Dofmt(RC[-2],RC[1]) -> 12345.6789 | E29: @ | F29: =RC[-4] -> 12345.678900000001

Sheet: ImpliedNegative
A1: Format | B1: Value | C1: B Fmt | D1: VBA Fmt | E1: Fmt
A2: 0 | B2: -12345.678900000001 | C2: =NumFmt(RC[-1]) -> General
A3: 1 | B3: -12345.678900000001 | C3: =NumFmt(RC[-1]) -> 0 | D3: =Dofmt(RC[-2],RC[1]) -> -12346 | E3: 0 | F3: =RC[-1]=RC[-3] -> 1
A4: 2 | B4: -12345.678900000001 | C4: =NumFmt(RC[-1]) -> 0.00 | D4: =Dofmt(RC[-2],RC[1]) -> -12345.68 | E4: 0.00 | F4: =RC[-1]=RC[-3] -> 1
A5: 3 | B5: -12345.678900000001 | C5: =NumFmt(RC[-1]) -> #,##0 | D5: =Dofmt(RC[-2],RC[1]) -> -12,346 | E5: #,##0 | F5: =RC[-1]=RC[-3] -> 1
A6: 4 | B6: -12345.678900000001 | C6: =NumFmt(RC[-1]) -> #,##0.00 | D6: =Dofmt(RC[-2],RC[1]) -> -12,345.68 | E6: #,##0.00 | F6: =RC[-1]=RC[-3] -> 1
A7: 9 | B7: -12345.678900000001 | C7: =NumFmt(RC[-1]) -> 0% | D7: =Dofmt(RC[-2],RC[1]) -> -1234568% | E7: 0% | F7: =RC[-1]=RC[-3] -> 1
A8: 10 | B8: -12345.678900000001 | C8: =NumFmt(RC[-1]) -> 0.00% | D8: =Dofmt(RC[-2],RC[1]) -> -1234567.89% | E8: 0.00% | F8: =RC[-1]=RC[-3] -> 1
A9: 11 | B9: -12345.678900000001 | C9: =NumFmt(RC[-1]) -> 0.00E+00 | D9: =Dofmt(RC[-2],RC[1]) -> -1.23E+04 | E9: 0.00E+00 | F9: =RC[-1]=RC[-3] -> 1
A10: 12 | B10: -12345.678900000001 | C10: =NumFmt(RC[-1]) -> # ?/? | D10: =Dofmt(RC[-2],RC[1]) -> -12346 ?/? | E10: # ?/? | F10: =RC[-1]=RC[-3] -> 1
A11: 13 | B11: -12345.678900000001 | C11: =NumFmt(RC[-1]) -> # ??/?? | D11: =Dofmt(RC[-2],RC[1]) -> -12346 ??/?? | E11: # ??/?? | F11: =RC[-1]=RC[-3] -> 1
A12: 14 | B12: 1866-03-13T07:42:23.040 | C12: =NumFmt(RC[-1]) -> m/d/yyyy | D12: =Dofmt(RC[-2],RC[1]) -> 3/13/66 | E12: m/d/yy | F12: =RC[-1]=RC[-3] -> 0 | G12: * What is this supposed to be?
A13: 15 | B13: 1866-03-13T07:42:23.040 | C13: =NumFmt(RC[-1]) -> d-mmm-yy | D13: =Dofmt(RC[-2],RC[1]) -> 13-Mar-66 | E13: d-mmm-yy | F13: =RC[-1]=RC[-3] -> 1
A14: 16 | B14: 1866-03-13T07:42:23.040 | C14: =NumFmt(RC[-1]) -> d-mmm | D14: =Dofmt(RC[-2],RC[1]) -> 13-Mar | E14: d-mmm | F14: =RC[-1]=RC[-3] -> 1
A15: 17 | B15: 1866-03-13T07:42:23.040 | C15: =NumFmt(RC[-1]) -> mmm-yy | D15: =Dofmt(RC[-2],RC[1]) -> Mar-66 | E15: mmm-yy | F15: =RC[-1]=RC[-3] -> 1
A16: 18 | B16: 1866-03-13T07:42:23.040 | C16: =NumFmt(RC[-1]) -> h:mm AM/PM | D16: =Dofmt(RC[-2],RC[1]) -> 4:17 PM | E16: h:mm AM/PM | F16: =RC[-1]=RC[-3] -> 1
A17: 19 | B17: 1866-03-13T07:42:23.040 | C17: =NumFmt(RC[-1]) -> h:mm:ss AM/PM | D17: =Dofmt(RC[-2],RC[1]) -> 4:17:37 PM | E17: h:mm:ss AM/PM | F17: =RC[-1]=RC[-3] -> 1
A18: 20 | B18: 1866-03-13T07:42:23.040 | C18: =NumFmt(RC[-1]) -> h:mm | D18: =Dofmt(RC[-2],RC[1]) -> 16:17 | E18: h:mm | F18: =RC[-1]=RC[-3] -> 1
A19: 21 | B19: 1866-03-13T07:42:23.040 | C19: =NumFmt(RC[-1]) -> h:mm:ss | D19: =Dofmt(RC[-2],RC[1]) -> 16:17:37 | E19: h:mm:ss | F19: =RC[-1]=RC[-3] -> 1
A20: 22 | B20: 1866-03-13T07:42:23.040 | C20: =NumFmt(RC[-1]) -> m/d/yy h:mm | D20: =Dofmt(RC[-2],RC[1]) -> 3/13/66 16:17 | E20: m/d/yy h:mm | F20: =RC[-1]=RC[-3] -> 1
A21: 37 | B21: -12345.678900000001 | C21: =NumFmt(RC[-1]) -> #,##0 ;(#,##0) | D21: =Dofmt(RC[-2],RC[1]) -> (12,346) | E21: #,##0 ;(#,##0) | F21: =RC[-1]=RC[-3] -> 1
A22: 38 | B22: -12345.678900000001 | C22: =NumFmt(RC[-1]) -> #,##0 ;[Red](#,##0) | D22: =Dofmt(RC[-2],RC[1]) -> (12,346) | E22: #,##0 ;[Red](#,##0) | F22: =RC[-1]=RC[-3] -> 1
A23: 39 | B23: -12345.678900000001 | C23: =NumFmt(RC[-1]) -> #,##0.00;(#,##0.00) | D23: =Dofmt(RC[-2],RC[1]) -> (12,345.68) | E23: #,##0.00;(#,##0.00) | F23: =RC[-1]=RC[-3] -> 1
A24: 40 | B24: -12345.678900000001 | C24: =NumFmt(RC[-1]) -> #,##0.00;[Red](#,##0.00) | D24: =Dofmt(RC[-2],RC[1]) -> (12,345.68) | E24: #,##0.00;[Red](#,##0.00) | F24: =RC[-1]=RC[-3] -> 1
A25: 45 | B25: 1866-03-13T07:42:23.040 | C25: =NumFmt(RC[-1]) -> mm:ss | D25: =Dofmt(RC[-2],RC[1]) -> 03:37 | E25: mm:ss | F25: =RC[-1]=RC[-3] -> 1
A26: 46 | B26: 1866-03-13T07:42:23.040 | C26: =NumFmt(RC[-1]) -> [h]:mm:ss | D26: =Dofmt(RC[-2],RC[1]) -> :03:37 | E26: [h]:mm:ss | F26: =RC[-1]=RC[-3] -> 1
A27: 47 | B27: 1866-03-13T07:42:23.040 | C27: =NumFmt(RC[-1]) -> mmss.0 | D27: =Dofmt(RC[-2],RC[1]) -> 0337.0 | E27: mmss.0 | F27: =RC[-1]=RC[-3] -> 1
A28: 48 | B28: -12345.678900000001 | C28: =NumFmt(RC[-1]) -> ##0.0E+0 | D28: =Dofmt(RC[-2],RC[1]) -> -123.5E+2 | E28: ##0.0E+0 | F28: =RC[-1]=RC[-3] -> 1
A29: 49 | B29: -12345.678900000001 | C29: =NumFmt(RC[-1]) -> @ | D29: =Dofmt(RC[-2],RC[1]) -> -12345.6789 | E29: @ | F29: =RC[-1]=RC[-3] -> 1

Sheet: 2011
A1: General | B1: 1 | C1: -1.2 | D1: 12.3 | E1: -12.34 | F1: 123.45 | G1: -123.456 | H1: 1234.567 | I1: -1234.5678 | J1: 12345.678900000001 | K1: -12345.678910000001
A3: Number | B3: 1 | C3: -1.2 | D3: 12.3 | E3: -12.34 | F3: 123.45 | G3: -123.456 | H3: 1234.567 | I3: -1234.5678 | J3: 12345.678900000001 | K3: -12345.678910000001
B4: 1 | C4: -1.2 | D4: 12.3 | E4: -12.34 | F4: 123.45 | G4: -123.456 | H4: 1234.567 | I4: -1234.5678 | J4: 12345.678900000001 | K4: -12345.678910000001
B5: 1 | C5: -1.2 | D5: 12.3 | E5: -12.34 | F5: 123.45 | G5: -123.456 | H5: 1234.567 | I5: -1234.5678 | J5: 12345.678900000001 | K5: -12345.678910000001
B6: 1 | C6: -1.2 | D6: 12.3 | E6: -12.34 | F6: 123.45 | G6: -123.456 | H6: 1234.567 | I6: -1234.5678 | J6: 12345.678900000001 | K6: -12345.678910000001
B7: 1 | C7: -1.2 | D7: 12.3 | E7: -12.34 | F7: 123.45 | G7: -123.456 | H7: 1234.567 | I7: -1234.5678 | J7: 12345.678900000001 | K7: -12345.678910000001
B8: 1 | C8: -1.2 | D8: 12.3 | E8: -12.34 | F8: 123.45 | G8: -123.456 | H8: 1234.567 | I8: -1234.5678 | J8: 12345.678900000001 | K8: -12345.678910000001
B9: 1 | C9: -1.2 | D9: 12.3 | E9: -12.34 | F9: 123.45 | G9: -123.456 | H9: 1234.567 | I9: -1234.5678 | J9: 12345.678900000001 | K9: -12345.678910000001
B10: 1 | C10: -1.2 | D10: 12.3 | E10: -12.34 | F10: 123.45 | G10: -123.456 | H10: 1234.567 | I10: -1234.5678 | J10: 12345.678900000001 | K10: -12345.678910000001
B11: 1 | C11: -1.2 | D11: 12.3 | E11: -12.34 | F11: 123.45 | G11: -123.456 | H11: 1234.567 | I11: -1234.5678 | J11: 12345.678900000001 | K11: -12345.678910000001
B12: 1 | C12: -1.2 | D12: 12.3 | E12: -12.34 | F12: 123.45 | G12: -123.456 | H12: 1234.567 | I12: -1234.5678 | J12: 12345.678900000001 | K12: -12345.678910000001
B13: 1 | C13: -1.2 | D13: 12.3 | E13: -12.34 | F13: 123.45 | G13: -123.456 | H13: 1234.567 | I13: -1234.5678 | J13: 12345.678900000001 | K13: -12345.678910000001
B14: 1 | C14: -1.2 | D14: 12.3 | E14: -12.34 | F14: 123.45 | G14: -123.456 | H14: 1234.567 | I14: -1234.5678 | J14: 12345.678900000001 | K14: -12345.678910000001
A16: Currency | B16: 1 | C16: -1.2 | D16: 12.3 | E16: -12.34 | F16: 123.45 | G16: -123.456 | H16: 1234.567 | I16: -1234.5678 | J16: 12345.678900000001 | K16: -12345.678910000001
B17: 1 | C17: -1.2 | D17: 12.3 | E17: -12.34 | F17: 123.45 | G17: -123.456 | H17: 1234.567 | I17: -1234.5678 | J17: 12345.678900000001 | K17: -12345.678910000001
B18: 1 | C18: -1.2 | D18: 12.3 | E18: -12.34 | F18: 123.45 | G18: -123.456 | H18: 1234.567 | I18: -1234.5678 | J18: 12345.678900000001 | K18: -12345.678910000001
B19: 1 | C19: -1.2 | D19: 12.3 | E19: -12.34 | F19: 123.45 | G19: -123.456 | H19: 1234.567 | I19: -1234.5678 | J19: 12345.678900000001 | K19: -12345.678910000001
B20: 1 | C20: -1.2 | D20: 12.3 | E20: -12.34 | F20: 123.45 | G20: -123.456 | H20: 1234.567 | I20: -1234.5678 | J20: 12345.678900000001 | K20: -12345.678910000001
B21: 1 | C21: -1.2 | D21: 12.3 | E21: -12.34 | F21: 123.45 | G21: -123.456 | H21: 1234.567 | I21: -1234.5678 | J21: 12345.678900000001 | K21: -12345.678910000001
A23: Accounting | B23: 1 | C23: -1.2 | D23: 12.3 | E23: -12.34 | F23: 123.45 | G23: -123.456 | H23: 1234.567 | I23: -1234.5678 | J23: 12345.678900000001 | K23: -12345.678910000001
B24: 1 | C24: -1.2 | D24: 12.3 | E24: -12.34 | F24: 123.45 | G24: -123.456 | H24: 1234.567 | I24: -1234.5678 | J24: 12345.678900000001 | K24: -12345.678910000001
B25: 1 | C25: -1.2 | D25: 12.3 | E25: -12.34 | F25: 123.45 | G25: -123.456 | H25: 1234.567 | I25: -1234.5678 | J25: 12345.678900000001 | K25: -12345.678910000001
A27: Date | B27: 1900-01-01T00:00:00.000 | C27: 1899-12-29T19:12:00.000 | D27: 1900-01-12T07:12:00.000 | E27: 1899-12-18T15:50:24.000 | F27: 1900-05-02T10:48:00.000 | G27: 1899-08-29T13:03:21.600 | H27: 1903-05-18T13:36:28.800 | I27: 1896-08-13T10:22:22.080 | J27: 1933-10-18T16:17:36.960 | K27: 1866-03-13T07:42:22.176
B28: 1900-01-01T00:00:00.000 | C28: 1899-12-29T19:12:00.000 | D28: 1900-01-12T07:12:00.000 | E28: 1899-12-18T15:50:24.000 | F28: 1900-05-02T10:48:00.000 | G28: 1899-08-29T13:03:21.600 | H28: 1903-05-18T13:36:28.800 | I28: 1896-08-13T10:22:22.080 | J28: 1933-10-18T16:17:36.960 | K28: 1866-03-13T07:42:22.176
B29: 1900-01-01T00:00:00.000 | C29: 1899-12-29T19:12:00.000 | D29: 1900-01-12T07:12:00.000 | E29: 1899-12-18T15:50:24.000 | F29: 1900-05-02T10:48:00.000 | G29: 1899-08-29T13:03:21.600 | H29: 1903-05-18T13:36:28.800 | I29: 1896-08-13T10:22:22.080 | J29: 1933-10-18T16:17:36.960 | K29: 1866-03-13T07:42:22.176
B30: 1900-01-01T00:00:00.000 | C30: 1899-12-29T19:12:00.000 | D30: 1900-01-12T07:12:00.000 | E30: 1899-12-18T15:50:24.000 | F30: 1900-05-02T10:48:00.000 | G30: 1899-08-29T13:03:21.600 | H30: 1903-05-18T13:36:28.800 | I30: 1896-08-13T10:22:22.080 | J30: 1933-10-18T16:17:36.960 | K30: 1866-03-13T07:42:22.176
B31: 1900-01-01T00:00:00.000 | C31: 1899-12-29T19:12:00.000 | D31: 1900-01-12T07:12:00.000 | E31: 1899-12-18T15:50:24.000 | F31: 1900-05-02T10:48:00.000 | G31: 1899-08-29T13:03:21.600 | H31: 1903-05-18T13:36:28.800 | I31: 1896-08-13T10:22:22.080 | J31: 1933-10-18T16:17:36.960 | K31: 1866-03-13T07:42:22.176
B32: 1900-01-01T00:00:00.000 | C32: 1899-12-29T19:12:00.000 | D32: 1900-01-12T07:12:00.000 | E32: 1899-12-18T15:50:24.000 | F32: 1900-05-02T10:48:00.000 | G32: 1899-08-29T13:03:21.600 | H32: 1903-05-18T13:36:28.800 | I32: 1896-08-13T10:22:22.080 | J32: 1933-10-18T16:17:36.960 | K32: 1866-03-13T07:42:22.176
B33: 1900-01-01T00:00:00.000 | C33: 1899-12-29T19:12:00.000 | D33: 1900-01-12T07:12:00.000 | E33: 1899-12-18T15:50:24.000 | F33: 1900-05-02T10:48:00.000 | G33: 1899-08-29T13:03:21.600 | H33: 1903-05-18T13:36:28.800 | I33: 1896-08-13T10:22:22.080 | J33: 1933-10-18T16:17:36.960 | K33: 1866-03-13T07:42:22.176
B34: 1900-01-01T00:00:00.000 | C34: 1899-12-29T19:12:00.000 | D34: 1900-01-12T07:12:00.000 | E34: 1899-12-18T15:50:24.000 | F34: 1900-05-02T10:48:00.000 | G34: 1899-08-29T13:03:21.600 | H34: 1903-05-18T13:36:28.800 | I34: 1896-08-13T10:22:22.080 | J34: 1933-10-18T16:17:36.960 | K34: 1866-03-13T07:42:22.176
B35: 1900-01-01T00:00:00.000 | C35: 1899-12-29T19:12:00.000 | D35: 1900-01-12T07:12:00.000 | E35: 1899-12-18T15:50:24.000 | F35: 1900-05-02T10:48:00.000 | G35: 1899-08-29T13:03:21.600 | H35: 1903-05-18T13:36:28.800 | I35: 1896-08-13T10:22:22.080 | J35: 1933-10-18T16:17:36.960 | K35: 1866-03-13T07:42:22.176
B36: 1900-01-01T00:00:00.000 | C36: 1899-12-29T19:12:00.000 | D36: 1900-01-12T07:12:00.000 | E36: 1899-12-18T15:50:24.000 | F36: 1900-05-02T10:48:00.000 | G36: 1899-08-29T13:03:21.600 | H36: 1903-05-18T13:36:28.800 | I36: 1896-08-13T10:22:22.080 | J36: 1933-10-18T16:17:36.960 | K36: 1866-03-13T07:42:22.176
B37: 1900-01-01T00:00:00.000 | C37: 1899-12-29T19:12:00.000 | D37: 1900-01-12T07:12:00.000 | E37: 1899-12-18T15:50:24.000 | F37: 1900-05-02T10:48:00.000 | G37: 1899-08-29T13:03:21.600 | H37: 1903-05-18T13:36:28.800 | I37: 1896-08-13T10:22:22.080 | J37: 1933-10-18T16:17:36.960 | K37: 1866-03-13T07:42:22.176
B38: 1900-01-01T00:00:00.000 | C38: 1899-12-29T19:12:00.000 | D38: 1900-01-12T07:12:00.000 | E38: 1899-12-18T15:50:24.000 | F38: 1900-05-02T10:48:00.000 | G38: 1899-08-29T13:03:21.600 | H38: 1903-05-18T13:36:28.800 | I38: 1896-08-13T10:22:22.080 | J38: 1933-10-18T16:17:36.960 | K38: 1866-03-13T07:42:22.176
B39: 1900-01-01T00:00:00.000 | C39: 1899-12-29T19:12:00.000 | D39: 1900-01-12T07:12:00.000 | E39: 1899-12-18T15:50:24.000 | F39: 1900-05-02T10:48:00.000 | G39: 1899-08-29T13:03:21.600 | H39: 1903-05-18T13:36:28.800 | I39: 1896-08-13T10:22:22.080 | J39: 1933-10-18T16:17:36.960 | K39: 1866-03-13T07:42:22.176
B40: 1900-01-01T00:00:00.000 | C40: 1899-12-29T19:12:00.000 | D40: 1900-01-12T07:12:00.000 | E40: 1899-12-18T15:50:24.000 | F40: 1900-05-02T10:48:00.000 | G40: 1899-08-29T13:03:21.600 | H40: 1903-05-18T13:36:28.800 | I40: 1896-08-13T10:22:22.080 | J40: 1933-10-18T16:17:36.960 | K40: 1866-03-13T07:42:22.176
B41: 1900-01-01T00:00:00.000 | C41: 1899-12-29T19:12:00.000 | D41: 1900-01-12T07:12:00.000 | E41: 1899-12-18T15:50:24.000 | F41: 1900-05-02T10:48:00.000 | G41: 1899-08-29T13:03:21.600 | H41: 1903-05-18T13:36:28.800 | I41: 1896-08-13T10:22:22.080 | J41: 1933-10-18T16:17:36.960 | K41: 1866-03-13T07:42:22.176
B42: 1900-01-01T00:00:00.000 | C42: 1899-12-29T19:12:00.000 | D42: 1900-01-12T07:12:00.000 | E42: 1899-12-18T15:50:24.000 | F42: 1900-05-02T10:48:00.000 | G42: 1899-08-29T13:03:21.600 | H42: 1903-05-18T13:36:28.800 | I42: 1896-08-13T10:22:22.080 | J42: 1933-10-18T16:17:36.960 | K42: 1866-03-13T07:42:22.176
B43: 1900-01-01T00:00:00.000 | C43: 1899-12-29T19:12:00.000 | D43: 1900-01-12T07:12:00.000 | E43: 1899-12-18T15:50:24.000 | F43: 1900-05-02T10:48:00.000 | G43: 1899-08-29T13:03:21.600 | H43: 1903-05-18T13:36:28.800 | I43: 1896-08-13T10:22:22.080 | J43: 1933-10-18T16:17:36.960 | K43: 1866-03-13T07:42:22.176
A45: Time | B45: 1900-01-01T00:00:00.000 | C45: 1899-12-29T19:12:00.000 | D45: 1900-01-12T07:12:00.000 | E45: 1899-12-18T15:50:24.000 | F45: 1900-05-02T10:48:00.000 | G45: 1899-08-29T13:03:21.600 | H45: 1903-05-18T13:36:28.800 | I45: 1896-08-13T10:22:22.080 | J45: 1933-10-18T16:17:36.960 | K45: 1866-03-13T07:42:22.176
B46: 1900-01-01T00:00:00.000 | C46: 1899-12-29T19:12:00.000 | D46: 1900-01-12T07:12:00.000 | E46: 1899-12-18T15:50:24.000 | F46: 1900-05-02T10:48:00.000 | G46: 1899-08-29T13:03:21.600 | H46: 1903-05-18T13:36:28.800 | I46: 1896-08-13T10:22:22.080 | J46: 1933-10-18T16:17:36.960 | K46: 1866-03-13T07:42:22.176
B47: 1900-01-01T00:00:00.000 | C47: 1899-12-29T19:12:00.000 | D47: 1900-01-12T07:12:00.000 | E47: 1899-12-18T15:50:24.000 | F47: 1900-05-02T10:48:00.000 | G47: 1899-08-29T13:03:21.600 | H47: 1903-05-18T13:36:28.800 | I47: 1896-08-13T10:22:22.080 | J47: 1933-10-18T16:17:36.960 | K47: 1866-03-13T07:42:22.176
B48: 1900-01-01T00:00:00.000 | C48: 1899-12-29T19:12:00.000 | D48: 1900-01-12T07:12:00.000 | E48: 1899-12-18T15:50:24.000 | F48: 1900-05-02T10:48:00.000 | G48: 1899-08-29T13:03:21.600 | H48: 1903-05-18T13:36:28.800 | I48: 1896-08-13T10:22:22.080 | J48: 1933-10-18T16:17:36.960 | K48: 1866-03-13T07:42:22.176
B49: 1900-01-01T00:00:00.000 | C49: 1899-12-29T19:12:00.000 | D49: 1900-01-12T07:12:00.000 | E49: 1899-12-18T15:50:24.000 | F49: 1900-05-02T10:48:00.000 | G49: 1899-08-29T13:03:21.600 | H49: 1903-05-18T13:36:28.800 | I49: 1896-08-13T10:22:22.080 | J49: 1933-10-18T16:17:36.960 | K49: 1866-03-13T07:42:22.176
B50: 1900-01-01T00:00:00.000 | C50: 1899-12-29T19:12:00.000 | D50: 1900-01-12T07:12:00.000 | E50: 1899-12-18T15:50:24.000 | F50: 1900-05-02T10:48:00.000 | G50: 1899-08-29T13:03:21.600 | H50: 1903-05-18T13:36:28.800 | I50: 1896-08-13T10:22:22.080 | J50: 1933-10-18T16:17:36.960 | K50: 1866-03-13T07:42:22.176
B51: 1900-01-01T00:00:00.000 | C51: 1899-12-29T19:12:00.000 | D51: 1900-01-12T07:12:00.000 | E51: 1899-12-18T15:50:24.000 | F51: 1900-05-02T10:48:00.000 | G51: 1899-08-29T13:03:21.600 | H51: 1903-05-18T13:36:28.800 | I51: 1896-08-13T10:22:22.080 | J51: 1933-10-18T16:17:36.960 | K51: 1866-03-13T07:42:22.176
B52: 1900-01-01T00:00:00.000 | C52: 1899-12-29T19:12:00.000 | D52: 1900-01-12T07:12:00.000 | E52: 1899-12-18T15:50:24.000 | F52: 1900-05-02T10:48:00.000 | G52: 1899-08-29T13:03:21.600 | H52: 1903-05-18T13:36:28.800 | I52: 1896-08-13T10:22:22.080 | J52: 1933-10-18T16:17:36.960 | K52: 1866-03-13T07:42:22.176
B53: 1900-01-01T00:00:00.000 | C53: 1899-12-29T19:12:00.000 | D53: 1900-01-12T07:12:00.000 | E53: 1899-12-18T15:50:24.000 | F53: 1900-05-02T10:48:00.000 | G53: 1899-08-29T13:03:21.600 | H53: 1903-05-18T13:36:28.800 | I53: 1896-08-13T10:22:22.080 | J53: 1933-10-18T16:17:36.960 | K53: 1866-03-13T07:42:22.176
A55: Percentage | B55: 1 | C55: -1.2 | D55: 12.3 | E55: -12.34 | F55: 123.45 | G55: -123.456 | H55: 1234.567 | I55: -1234.5678 | J55: 12345.678900000001 | K55: -12345.678910000001
A57: Fraction | B57: 1 | C57: -1.2 | D57: 12.3 | E57: -12.34 | F57: 123.45 | G57: -123.456 | H57: 1234.567 | I57: -1234.5678 | J57: 12345.678900000001 | K57: -12345.678910000001
B58: 1 | C58: -1.2 | D58: 12.3 | E58: -12.34 | F58: 123.45 | G58: -123.456 | H58: 1234.567 | I58: -1234.5678 | J58: 12345.678900000001 | K58: -12345.678910000001
B59: 1 | C59: -1.2 | D59: 12.3 | E59: -12.34 | F59: 123.45 | G59: -123.456 | H59: 1234.567 | I59: -1234.5678 | J59: 12345.678900000001 | K59: -12345.678910000001
B60: 1 | C60: -1.2 | D60: 12.3 | E60: -12.34 | F60: 123.45 | G60: -123.456 | H60: 1234.567 | I60: -1234.5678 | J60: 12345.678900000001 | K60: -12345.678910000001
B61: 1 | C61: -1.2 | D61: 12.3 | E61: -12.34 | F61: 123.45 | G61: -123.456 | H61: 1234.567 | I61: -1234.5678 | J61: 12345.678900000001 | K61: -12345.678910000001
B62: 1 | C62: -1.2 | D62: 12.3 | E62: -12.34 | F62: 123.45 | G62: -123.456 | H62: 1234.567 | I62: -1234.5678 | J62: 12345.678900000001 | K62: -12345.678910000001
B63: 1 | C63: -1.2 | D63: 12.3 | E63: -12.34 | F63: 123.45 | G63: -123.456 | H63: 1234.567 | I63: -1234.5678 | J63: 12345.678900000001 | K63: -12345.678910000001
B64: 1 | C64: -1.2 | D64: 12.3 | E64: -12.34 | F64: 123.45 | G64: -123.456 | H64: 1234.567 | I64: -1234.5678 | J64: 12345.678900000001 | K64: -12345.678910000001
B65: 1 | C65: -1.2 | D65: 12.3 | E65: -12.34 | F65: 123.45 | G65: -123.456 | H65: 1234.567 | I65: -1234.5678 | J65: 12345.678900000001 | K65: -12345.678910000001
A67: Scientific | B67: 1 | C67: -1.2 | D67: 12.3 | E67: -12.34 | F67: 123.45 | G67: -123.456 | H67: 1234.567 | I67: -1234.5678 | J67: 12345.678900000001 | K67: -12345.678910000001
A69: Text | B69: 1 | C69: -1.2 | D69: 12.3 | E69: -12.34 | F69: 123.45 | G69: -123.456 | H69: 1234.567 | I69: -1234.5678 | J69: 12345.678900000001 | K69: -12345.678910000001
A71: Special | B71: 1 | C71: -1.2 | D71: 12.3 | E71: -12.34 | F71: 123.45 | G71: -123.456 | H71: 1234.567 | I71: -1234.5678 | J71: 12345.678900000001 | K71: -12345.678910000001
B72: 1 | C72: -1.2 | D72: 12.3 | E72: -12.34 | F72: 123.45 | G72: -123.456 | H72: 1234.567 | I72: -1234.5678 | J72: 12345.678900000001 | K72: -12345.678910000001
B73: 1 | C73: -1.2 | D73: 12.3 | E73: -12.34 | F73: 123.45 | G73: -123.456 | H73: 1234.567 | I73: -1234.5678 | J73: 12345.678900000001 | K73: -12345.678910000001
B74: 1 | C74: -1.2 | D74: 12.3 | E74: -12.34 | F74: 123.45 | G74: -123.456 | H74: 1234.567 | I74: -1234.5678 | J74: 12345.678900000001 | K74: -12345.678910000001

Sheet: Miscellany
A1: 1
A2: 1
A3: 10
A4: 100
A5: 1000
A6: 10000
A7: 100000
A8: 1000000
A9: 10000000

Sheet: SSF
A1: General | B1: 1 | C1: -1.2 | D1: 12.3 | E1: -12.34 | F1: 123.45 | G1: -123.456 | H1: 1234.567 | I1: -1234.5678 | J1: 12345.678900000001 | K1: -12345.678910000001
A2: ##0.0E+0 | B2: 1 | C2: -1.2 | D2: 12.3 | E2: -12.34 | F2: 123.45 | G2: -123.456 | H2: 1234.567 | I2: -1234.5678 | J2: 12345.678900000001 | K2: -12345.678910000001
A3: #,##0 | B3: 1 | C3: -1.2 | D3: 12.3 | E3: -12.34 | F3: 123.45 | G3: -123.456 | H3: 1234.567 | I3: -1234.5678 | J3: 12345.678900000001 | K3: -12345.678910000001
A4: #,##0.0 | B4: 1 | C4: -1.2 | D4: 12.3 | E4: -12.34 | F4: 123.45 | G4: -123.456 | H4: 1234.567 | I4: -1234.5678 | J4: 12345.678900000001 | K4: -12345.678910000001
A5: #,##0.00 | B5: 1 | C5: -1.2 | D5: 12.3 | E5: -12.34 | F5: 123.45 | G5: -123.456 | H5: 1234.567 | I5: -1234.5678 | J5: 12345.678900000001 | K5: -12345.678910000001
A6: #,##0.000 | B6: 1 | C6: -1.2 | D6: 12.3 | E6: -12.34 | F6: 123.45 | G6: -123.456 | H6: 1234.567 | I6: -1234.5678 | J6: 12345.678900000001 | K6: -12345.678910000001
A7: #,##0.0000 | B7: 1 | C7: -1.2 | D7: 12.3 | E7: -12.34 | F7: 123.45 | G7: -123.456 | H7: 1234.567 | I7: -1234.5678 | J7: 12345.678900000001 | K7: -12345.678910000001
A8: #,##0.00000 | B8: 1 | C8: -1.2 | D8: 12.3 | E8: -12.34 | F8: 123.45 | G8: -123.456 | H8: 1234.567 | I8: -1234.5678 | J8: 12345.678900000001 | K8: -12345.678910000001
A9: #,##0.000000 | B9: 1 | C9: -1.2 | D9: 12.3 | E9: -12.34 | F9: 123.45 | G9: -123.456 | H9: 1234.567 | I9: -1234.5678 | J9: 12345.678900000001 | K9: -12345.678910000001
A10: #,##0.0000000 | B10: 1 | C10: -1.2 | D10: 12.3 | E10: -12.34 | F10: 123.45 | G10: -123.456 | H10: 1234.567 | I10: -1234.5678 | J10: 12345.678900000001 | K10: -12345.678910000001
A11: #,##0.00000000 | B11: 1 | C11: -1.2 | D11: 12.3 | E11: -12.34 | F11: 123.45 | G11: -123.456 | H11: 1234.567 | I11: -1234.5678 | J11: 12345.678900000001 | K11: -12345.678910000001
A12: #,##0.000000000 | B12: 1 | C12: -1.2 | D12: 12.3 | E12: -12.34 | F12: 123.45 | G12: -123.456 | H12: 1234.567 | I12: -1234.5678 | J12: 12345.678900000001 | K12: -12345.678910000001